App,Store,App ID,Review ID,Country,Version,Rating,Date,Author,Subject,Body,Translated Subject,Translated Body
Vanilla Music,Google Play,ch.blinkenlights.android.vanilla,Z3A6QU9xcFRPSGVzT0FuU2U5VEJJaE5iT3JVRU5SUXFmekF3TzlGREhPZlFwWi1zd2lGRjE2Tjc2YkVWZFZDbVpQejFSdFVsYmltZ3B0NnpZSnBjaUxYN0E,Polish,,5,2017-04-20,Drag Droid,"","Sometimes it doesn't show my songs which are in the phone storage. Well it's not a big problem, everything else works perfect for me. Sleep timer shortcut icon at play screen could be helpful. Anyway I feel like it's better than many apps which weight is something between 5-10MB. And those apps don't have many additional features, I mean those apps just have more advanced ui. Anyway ui of this app is nice and app is running very smooth. Sorry for grammar mistakes etc.",,
Vanilla Music,Google Play,ch.blinkenlights.android.vanilla,Z3A6QU9xcFRPRVF5dkF2cDBCNHhlQWJCNVV5SktJemJ4dlpvck1tZWxxVjhRWGZHX1F3R2psQV9PMEN6bDFBS1hHOHEzYUdVUTBPRUVYQnFvaHdoR29fUGc,Polish,,5,2017-02-26,Rafał Kordowski,"","Small, fast, works!",,
Vanilla Music,Google Play,ch.blinkenlights.android.vanilla,Z3A6QU9xcFRPRllyQVZLYTI4Q2p4NWk5eWZ2R3ZreXVFRmVhMy1iSEdPa1lGLXFlRTc2UUN5X0JKRnRpbjlpbEpyQktlMlRoTGdudURmR0c3NzVWTldCX0E,Polish,,5,2016-10-21,Jake The Dog,Najlepsza!,"Bardzo dobra jakość dźwięku, bardzo przystępny wygląd, mały rozmiar aplikacji, brak reklam i płatności! Czego chcieć więcej od playera?",,
Vanilla Music,Google Play,ch.blinkenlights.android.vanilla,Z3A6QU9xcFRPRlRPNDEzV29XM3FZMTFXTlpWUzQ2SWVjWUM1c0t3QnBlc2diS2Vvd3piUWd0bmJtZGJpUGdFUjR5MXN6SUI2anZEajd6dm8tcTlFaGYtQVE,Polish,,5,2016-10-15,Patryk Ciszewski,Polecam,Jedyny odtwarzacz którego używam od dłuższego czasu ;),,
Vanilla Music,Google Play,ch.blinkenlights.android.vanilla,Z3A6QU9xcFRPSE5ndl9Ud0x5TDlZOXhGSmR6WXdpSTJUWnRKODA0NjRNX3NmWV80THRUMnRKR3pxYUFKekx3Q0NkdDA2QzhzUDNTQS1ic2Q1Z2ZuU1ZTYlE,Polish,,5,2014-08-04,buko tab,"","Open source, without advertisements, able to open folder or file",,
Vanilla Music,Google Play,ch.blinkenlights.android.vanilla,Z3A6QU9xcFRPRmc2THNsclhVOTdqbVRRTDNHRHFqcVNPcUh0c2hnQ0EtazBqU1pvSF9nSzREenJvMEpZNDFJT04teVBvTm1WS3NiUksxLVZsVFlOblpPS1E,Polish,,5,2014-01-27,"",That's CrunchMusic-Player Like,"Pros: Open Source,FLAC (from a Old version,with a 2.3 Support) - Like as ""Apollo"" [For CyanogenMod] - But in a Old Version is Lightest. Cons: in Gingerbread version: That's doesn't haves - Works around./In Newest (Newest is does works around): That's not less than ""andLess"" [in Gingerbread does a crashes.]",,
Vanilla Music,Google Play,ch.blinkenlights.android.vanilla,Z3A6QU9xcFRPSFdSSHFsNEpJM1U1RkV2ZzhsQUMyNXpwUFQ3OVROQ3BrQjlKeTdpRXhrVE9mQ0FuVWhIaFNZRndMb3MzSTQ4Rkp5VlB1T3BhWFliYXRsUEE,Portuguese,,5,2017-04-26,"","","Sensacional: limpo, leve, funcional, com bons recursos e as músicas tocam sem travar (graças ao readahead). Espetacular!!!",,
Vanilla Music,Google Play,ch.blinkenlights.android.vanilla,Z3A6QU9xcFRPSHBTSmFuQ2FuQW9OYVVHS0xrT0lQRi1ZVFljQVYwcUJRd2hEY0drMTFGejYzenRfSUhseldkMzhNU0VmOFBrcEJwdXhkTFVJd0RWMEd1clE,Portuguese,,5,2017-04-13,Paulo Freitas,"",Great,,
Vanilla Music,Google Play,ch.blinkenlights.android.vanilla,Z3A6QU9xcFRPRS1MX2t3MHhUdS1mOTJmZ0xxUHMzMXYxNnd0M0YxVXhTNmxGNVdkdGs3WmhONEZCd180VWtRNnk0V0RTRTJaXzlYb1NMWW9ZdTFuZFhtNkE,Portuguese,,5,2017-03-25,Fabricio Campos,"",Gostei mais,,
Vanilla Music,Google Play,ch.blinkenlights.android.vanilla,Z3A6QU9xcFRPRS0tTUhKWV83QWstMWtBQ19KQzBobGRDN0I1TVlBZXNHaGJ4ZlFFdVZBNzlHOTE0eTlOOGltZEcwWUZCRFRnZEhlODMzUzdld0gweEthYUE,Portuguese,,4,2017-02-27,Mathmocost,"","Bom player , mas precisa arrumar esses widgets que estão bugados etc...",,
Vanilla Music,Google Play,ch.blinkenlights.android.vanilla,Z3A6QU9xcFRPRTJfSXdEekVrRlhHU1ZFREljRHVoaGxBc0ZvejRxejJoMlNPY2wzQjlja0l3MzVoUXptUVlmNjNiVjlqOXpUblBHakRWRGxQcVUyeXMwVlE,Portuguese,,5,2017-01-23,Matheus Sprotte,"",-Melhor player de música de todos os tempos!-,,
Vanilla Music,Google Play,ch.blinkenlights.android.vanilla,Z3A6QU9xcFRPRVNFdUxLcFJZQ0FzTFBCQ2RIRDlLX0NrN0V1aFRoOFlVeHdObVFLREFrTHBRRzZ3NVRvQTNscFlBclMzbTRTWTZ0TkdWM1UtSDVBbjhERHc,Portuguese,,5,2016-10-07,Gerson Costa,Ótimo,"Mundo open source me surpreendendo sempre,  por enquanto o único que não repete músicas no modo aleatório e isso é incrivelmente ótimo",,
Vanilla Music,Google Play,ch.blinkenlights.android.vanilla,Z3A6QU9xcFRPRS1LNDZXeVBOckNhQjdfenlBb25hV3JLRlNsbl9fNTJPN1gyWUNEU01xVDFqaElzMG5ISmZCMmhvZ0ZTVTdHTE9GMFFXSkZSZlNBUEFiQUE,Portuguese,,4,2016-08-02,antonio marcal,Lindo,Ameiii,,
Vanilla Music,Google Play,ch.blinkenlights.android.vanilla,Z3A6QU9xcFRPRmFndnpicUZBdm11S0luelVLUTFOTmpzcWI5emtnU3ppSHQ4MnhFckR5OUNYb1JKc2gxZ09uV3Y1dUw1Qkh6cTl5a3cwd0xXMXhHMl9CQ1E,Portuguese,,5,2016-06-10,Jayson Galbin,Visual do antigo player do froyo,"Muito bom, simples, bonito, leve e open source, merece usar o nome Vanilla",,
Vanilla Music,Google Play,ch.blinkenlights.android.vanilla,Z3A6QU9xcFRPR196bTN0RFBHZ2xoel8zSnByc21CTFBsUHJqcXF6Znpldmh4WVc5OXNhS2ZMaWlnODVJUmloNlRfWjA4MEh3OXFWOGVQYTNPMTRDZGZiNGc,Portuguese,,5,2016-05-28,Mayra Mende's,show demais,"ele é otimo, muito melhor que o play music, baixem,vale a pena",,
Vanilla Music,Google Play,ch.blinkenlights.android.vanilla,Z3A6QU9xcFRPRjZuU0h3YUFHaXVOMi00M0ctMEE0Q0ZrSVNDY0xZY1dUSU1kSDY5aDRaVERpc3ZiWEJ6SmFhR18ySGhQZ0NUQU0xZURmeW1aODVIZ2pvWnc,Portuguese,,5,2016-05-26,Jhos Neto,"","Digno de carregar o nome ""VANILLA""",,
Vanilla Music,Google Play,ch.blinkenlights.android.vanilla,Z3A6QU9xcFRPRlB3dnp6NmZyeWttSklVWlVMbXNoMERxZGdzeEFIWl9Kcno2NlJaVVNLdnlmMzFxUjBGdWs1M3paQjNGOHJJRVFuRk9ST3hpUTNnTER4WlE,Portuguese,,4,2016-02-06,Davi,Retiraram o controle de volume,"O app é excelente, mas infelizmente não dá mais para amplificar ou reduzir o volume (0 à 150% do volume do celular), caso contrário daria 5 estrelas.",,
Vanilla Music,Google Play,ch.blinkenlights.android.vanilla,Z3A6QU9xcFRPRlBBQkhlOE13ekd6LVdRWXhGZDRoMS1FX05SRmE5SGpNcGo0OTQ1X05CV0dnaFJRenJDMXVEWDlzclktd2NaZ0ZadktjanRLbk9jcW9ZV3c,Portuguese,,5,2015-10-26,Marcelo Andrade,O melhor de todos,Pode baixar eu assino em baixo é o melhor APP que gerência áudios que existe,,
Vanilla Music,Google Play,ch.blinkenlights.android.vanilla,Z3A6QU9xcFRPSFVnaHhrX0JGblFTQ0VYb2dyN2MyRHdzOVJ6QUphLTVUdEJ3VnVRX1B3eHAtRmxPV01TaDVYRklxSlpHN2hMaVhuZVIzalNIemNXYUc4SVE,Portuguese,,5,2015-07-25,Andreo F. Rissardo,O melhor !!!!!,Ele é o melhor porquê é opensource e toca ogg. Viva a liberdade. #gnu #gpl #linux,,
Vanilla Music,Google Play,ch.blinkenlights.android.vanilla,Z3A6QU9xcFRPSHU5RzRWZzNEUmtUbHBUZVZJTGJqbTg2ZDFvY1BEbnIwczAzY0RtNGEzOWxaV3lqOXBqYmdoQ2pkWUFxU3NRNGF0QkxSUDBqdld3U29ONEE,Portuguese,,2,2015-05-08,Arthur Avila,A ultima atualização fico ruim,"Essa atualização deixou a interface toda branca de modo que me confundi, não sabia quando a repetição e o aleatório estavam ligados ou desligados. Por favor arrumem isso.",,
Vanilla Music,Google Play,ch.blinkenlights.android.vanilla,Z3A6QU9xcFRPRUVJVzlfalJvTjh5VWZYLUZaN0NXVzN1SGFMcHg2M1lZWlRIZFBCUmU0c09ZQ2JxOWpxRGFLYWFxdWxDRVhlYVMzeEp4NDBxSjA2UWYyS3c,Portuguese,,5,2015-05-07,Acassio Furtado,Amo cara,Melhor APP de player que já usei,,
Vanilla Music,Google Play,ch.blinkenlights.android.vanilla,Z3A6QU9xcFRPSE1uTldEQ3ctb3VmOXU2MUROczdUT3JJYkFFTVo4LURKV3dKaHdYemNkdmxoWTFheFVVTFBtUFd0eXFGb282R1VHZnRnLU5qcmRRUlVJY3c,Portuguese,,4,2015-04-01,Akura 01,Infelicidade,A ultima atualização ferro com tudo.,,
Vanilla Music,Google Play,ch.blinkenlights.android.vanilla,Z3A6QU9xcFRPSEhERWtKRnBiTW1XTXZuNTBaSmRiLXBCY2NNQ3VyLWoxQm5kS2dRdEVlWG14eFNKcGR4SW8wa3ZRQWlCd1N3UXVPUElfb1ZkMEl1dlpJUlE,Portuguese,,5,2015-01-11,deepsky,"",Please add the option to set song as ringtone in the context menu,,
Vanilla Music,Google Play,ch.blinkenlights.android.vanilla,Z3A6QU9xcFRPR2xHLWp5d3FkSkwtNlhVWFk1NzBxZy1RQlNMX2UxdHZQeW9OMmx1bHJ4RzhFNThHRVpHVndBVEtoOVp0Q1pJTFlQSHlzQld3ZUUteEYwRGc,Portuguese,,3,2015-01-01,Gislaine Couto,"",e bem legal,,
Vanilla Music,Google Play,ch.blinkenlights.android.vanilla,Z3A6QU9xcFRPSHJPUUxBQU5hSXpwRG1IQ2M0OWdGRFVXeER5VGZLbFI5dGd2ZmFqNEdUc0t1djBld3dHQTZZbHZNc0JMS0FKTjBUSUIyeS1YUkJpRHhnYlE,Portuguese,,5,2014-12-29,Estrela Lourissima,"","Gostei muito,fácil de formar nossas playlists.",,
Vanilla Music,Google Play,ch.blinkenlights.android.vanilla,Z3A6QU9xcFRPR1dZZEZuQk02WjV5cTBCU0tEN1RqcktERFlldnVhNkN5S1NvQVRFZjNuMW5DbFpPeGhodTdLV1JMNGg1VHozT1ZKOVdOc3FRcEpiWVJfN1E,Portuguese,,3,2014-12-26,Bianca Andrade,Nao sei,Vou ver se é bom#,,
Vanilla Music,Google Play,ch.blinkenlights.android.vanilla,bGc6QU9xcFRPRUYzX0F1VDdVZDlCV0hyVUpUV3hjNGxGYTNSR3V4NjllenppcU03b0Fva2hBRS10SUdnZC14aG1PdjJNeEtkY1V2NnNyOHNKS0JMQVVtb2c,Portuguese,,5,2014-12-19,Um usuário do Google,Ty,"",,
Vanilla Music,Google Play,ch.blinkenlights.android.vanilla,Z3A6QU9xcFRPRlY0aEVCUzVVZmJwdVc0WG9vQThNVWJHS1FJc293UXVaeEpKenNxOTdETktIbzBQYnpXSWlMQk56LWYtRm1nY2tvRUxWRjd4dXVZX0Q4NVE,Portuguese,,1,2014-10-27,vera avs,"",Horrível,,
Vanilla Music,Google Play,ch.blinkenlights.android.vanilla,Z3A6QU9xcFRPRWNfMVpLVGNibllIMkE3Q0ltcVFtNk03eFJMSWtYd1NPYWduQ1dXamNoT21jbW5WQm12UXBLQmJaUFN0bGl5ai1ldG1xaGtERG9KRTlaZ3c,Portuguese,,1,2014-10-25,Gesiel Assis,"",É um dos piores aplicativos que já baixei.,,
Vanilla Music,Google Play,ch.blinkenlights.android.vanilla,Z3A6QU9xcFRPRjEzQ3ZCWEZMM0VHVF9kNUZ2ejdOaTlvbG9yVHlFdVluejBnMDB2V2NxZnZwUXV4Zjc3aWZfWTkyMDBvanJKeDdiaFdNaVJOZFhaT050c2c,Portuguese,,5,2014-10-25,Jucimara Silva,"",Ok,,
Vanilla Music,Google Play,ch.blinkenlights.android.vanilla,Z3A6QU9xcFRPRk4zNHUtdFZ6VE14ZEtyemVqdlVEU2NvaFltMkM0Yll1eEhZeTFJbHkzQjJIMnF0cVF2bWgtMDQxUmZJeWstQ0RBMU1DdlpLczg0ak1vdGc,Portuguese,,5,2014-10-22,PixyTutos,"",É um pouco demorado mas é ótimo!,,
Vanilla Music,Google Play,ch.blinkenlights.android.vanilla,Z3A6QU9xcFRPRjB3ZUQ5MmRUVzhJa1p3SU10OGhCMUVRcmZoSEduSGx2WVZDbTM5S1p1cGVUdEtaUlNmdG1QY1g2c0Z6R2R6T0Vmczc2cmVEYy0tcldDd3c,Portuguese,,5,2014-10-19,Josimar Santos De Brito,Bo,Bom,,
Vanilla Music,Google Play,ch.blinkenlights.android.vanilla,Z3A6QU9xcFRPRUhzWVFFdTBlcmw0SmNKNmdTdUJ2eEtmYk5pTkF4U1liaHFsWFpCSEQtUjgzMzhFNGZpYlJYS19MUm5XOG5UNHBWeFFxTUNmLXlnVE9jTlE,Portuguese,,5,2014-10-19,Murilo Abreu,Sabe pq é o melhor?,"Único que tem opção rápida de sortear músicas dentro do album, e quando quiser volta a sortear no geral... Excelente!!",,
Vanilla Music,Google Play,ch.blinkenlights.android.vanilla,Z3A6QU9xcFRPRnpUeDhCeE1mU3d1TDBWcTc5Y2JiTXVoQktyQkhjNjVWeHJSbENXdEcyTEhtTGVUbC1NWTZJWFJMZDJSSU9FVmNtQzVhRW9aUGt0RDZkUlE,Portuguese,,5,2014-10-19,Denio prado,"",Bom,,
Vanilla Music,Google Play,ch.blinkenlights.android.vanilla,Z3A6QU9xcFRPRy0wSHAxc0kyTXFEU0NQUTU4VGs5SGxzTmt2THk1enpoWjR0N1Zob1N0SXUyTjdYeWQ5UXR3RkMydFIyaWd6SXBkR01MYzEybllJams2RHc,Portuguese,,4,2014-10-17,KleberVinicius Gonçalves,Mto bom,Bacana,,
Vanilla Music,Google Play,ch.blinkenlights.android.vanilla,Z3A6QU9xcFRPRkctcTY3cXhGQUhONVcwU3JsVTUxNFVOT1dETlpUQ3UwTGpNdFdUSkhQUjMwbHhBSHNjV1lCdGl1aWk0MkpxNkE2TzhxTGVZNWlDWURRSlE,Portuguese,,5,2014-10-14,rastro mogi,"",Musica,,
Vanilla Music,Google Play,ch.blinkenlights.android.vanilla,Z3A6QU9xcFRPRmlnXzhWMFdQd01aaDZoY01qUjdwZHhDell5SjdIMS1fNERJck5TSjlSTS1vbGR2cDFzMlZBQThyZ056R0xkaGhQTXNmOFBybjA4SUp4OFE,Portuguese,,1,2014-09-30,Marijane Costa,Chato,Chatoooo,,
Vanilla Music,Google Play,ch.blinkenlights.android.vanilla,Z3A6QU9xcFRPRzFtSVdnQkN6TDlkRU9aamVnTTFWeHk0NWI0ZC1RU3RoQTk3X01yM0NjM3BLc3poRG9vN3c0d0Y4MGxxYVQ2RGgtaUtjLVNlLURzZjNhVkE,Portuguese,,4,2014-04-26,gerson ramos dos santos,Bom,",mas apos a ultima atualização ta um lixo,toca uma musica e fexa,em qualquer mo do de reproducao...",,
Vanilla Music,Google Play,ch.blinkenlights.android.vanilla,Z3A6QU9xcFRPRzFLbmJXR1N6NHZ3cmNMLUNxcDR0VXhDVEtfQ0RJcFBUVzQ0RlJvR3I3elJ0NzRTUkpOblhWemtzUU1iNzRZeXBIM21qa1g4SnpxS1Voenc,Portuguese,,1,2014-03-27,Fabiano Nascimento,Fraco,Reproduz uma ou outra música em flac. Muito lento.,,
Vanilla Music,Google Play,ch.blinkenlights.android.vanilla,Z3A6QU9xcFRPSDROT1dXODVzWlZfNllvcjBuQzlNNTZmei04SUlLY0VjRUZlY3VmN0NwUUJobHY4SGdJNG5hQXR2QjFKN0N3WDd1WjAzTTI2Rm9kM0ZWZVE,Portuguese,,2,2013-12-23,Dréh Lima,Poderia ser muito mais,Nao consigo voltar a música Quando está tocando.,,
Vanilla Music,Google Play,ch.blinkenlights.android.vanilla,Z3A6QU9xcFRPSDY0LXkwa2g3UmJZVWVVM21lUnF3amdJWmlDbk5HQUF0cUwxbFJldzJsTUk0VGdMNVo4anhOeWRwQWVMc1dBbk53dDdxX3VLMHNGcXNvakE,Portuguese,,4,2013-11-11,Renan Amorim,E muito bom,Cara e o melhor até agora,,
Vanilla Music,Google Play,ch.blinkenlights.android.vanilla,Z3A6QU9xcFRPSHFpU3FjUTI4VTRUYkpuM2s5cTZwSWpkd0NaeXU3THo1VWh2UExlMU4tLUJ1ejhYVU1QX3NEbkFBTklzbFAyYnFRc1RFdGxrUGtTQURsVFE,Portuguese,,4,2013-07-13,Jorge Simesime,"",Fantastic,,
Vanilla Music,Google Play,ch.blinkenlights.android.vanilla,Z3A6QU9xcFRPSDJtTGpJNTRnc1ljT1RLWE1ld0pNTzU1TjN5OXhjT1JSMzJJZU1VWWNqaXBacDhXQ2ZoYngtREF5NnE4N2NxNDhwWFpqdDBwZW13LWx6SHc,Portuguese,,5,2013-06-04,Pastor Delvo Junior,Bom por demais,"Parabéns pelo app, muito bom mesmo... Com certeza é muito útil",,
Vanilla Music,Google Play,ch.blinkenlights.android.vanilla,Z3A6QU9xcFRPRlVSdWdZTTZIV1JDTlctT2NPU1laN1IwMkdCODZ0eVN1UXN2emt5S2dQMHI1N0pMMWR3VlRSUHBGTHZNOGNHeW82a3AzYUg1MmFlV2FMRGc,Portuguese,,5,2013-05-24,Thais Paiva,Mt bom,Oooooooootimo,,
Vanilla Music,Google Play,ch.blinkenlights.android.vanilla,Z3A6QU9xcFRPSGx5aW5kZU1Ed0RhWGNRTkloZDdrWXFjWWhLU1kzckY5azVrdlpwaWUzUkxHSXVHWWx6OW1OOG1qaWkxampGTWQ1MEU2QmFMVXRGRFdQNFE,Portuguese,,4,2013-05-09,Livia Maria,:-),Não instalei ainda mas parece bom,,
Vanilla Music,Google Play,ch.blinkenlights.android.vanilla,Z3A6QU9xcFRPRWVJbVlaU18tbWZGcWJwTTlVOGRaVWtpMG15ODRSUldDUjNCVTQwbXJOeWZIOUZUbVQyYXRiVE1hY1VUbWQzMXFMdWZsdnpobHcyemJTTWc,Portuguese,,1,2013-05-06,Aline Domingos,Bleca,Vai se lascar e a pior coisa do mundo!meu tablet faz isso e uma porcaria,,
Vanilla Music,Google Play,ch.blinkenlights.android.vanilla,Z3A6QU9xcFRPSEZpMVRUY0tBQVY0UVAxU2M0OFFLN0JhTElYWm5sek9jaEpFbHBTdmxOY2dhYmxhLXhzNHJ2ZjQ4dklUQzcwN092YnU1bXN6enVnTnRDSnc,Portuguese,,3,2013-04-17,Maristela Lima,Bom,Se tivesse equalizador seria perfeito.,,
Vanilla Music,Google Play,ch.blinkenlights.android.vanilla,Z3A6QU9xcFRPRXhPVVNhSERVX0lzNmh2QnpRbnp1TEF6NkFwank2U0FQVUloZ0ZfVFhFeE10MlBvSFBvQTY5RTg3eDNwcHJ3b2RVM0p5WmZuMTFPTnpPdnc,Portuguese,,5,2013-03-12,Adilson dos santos,XOOMM II. Obrigado,Funciona maravilhosamente bem!!!  Parabens a equipe desenvolvedora.,,
Vanilla Music,Google Play,ch.blinkenlights.android.vanilla,Z3A6QU9xcFRPR05xRUVYWmRqU1NBNXNOR25vdDdUVGRQdW5pVHBfeENYS3hfdjlkS1E1UHRZdjVQX2poV0V1bTRUOFFhcWY2ODlSN1NJRFgwLXpka0lsM3c,Russian,,1,2017-05-09,Tolia Ostapenko,"","Что в нем особенного? Все расхваливают а мой базовый и то в сто раз лучше.Он же папки читает, это ж ого-го.На маркете плееров читающих папки вагон и тележка.Простой? В нем настроек больше чем надо,а эквалайзера нет.Дизайн, что в нем классного? УНЫЛЫЙ КЛОН я знаю точно с десяток плееров один в один с этим.Кто хочет может писануть мне,и я скажу какие из бесплатных действительно суперовые.У меня самого стоят.Не хочу рекламировать а то заблокируют.Этот в топку.Извините разработчики, это клон,ничего личного.",,
Vanilla Music,Google Play,ch.blinkenlights.android.vanilla,Z3A6QU9xcFRPRzFPWlZjRWJqZU1oT1dQc2FGcDNFZUd3U1Z4MUZCUmlrbXYxZTY5VE5SOEV4dkdTRU9uM0lseVMtUTlGd3NFQTJ4OGZERkJ2bk1hZkViUEE,Russian,,5,2017-04-08,Дана Пасельська,"","Отличный плеер, с простым и понятным интерфейсом.",,
Vanilla Music,Google Play,ch.blinkenlights.android.vanilla,Z3A6QU9xcFRPSGJ1eEdLanZzLXNINE9MTzRzUXJGNHdSeFlkNkkwNFJNWjdUVnRhcE1CRWJZRGhSTUphRU5QTF9ON1ZFNnp6RG4wd0NlaVV3Um83V01ScHc,Russian,,5,2017-04-03,Elena Nik,"",Отлично! Спасибо =),,
Vanilla Music,Google Play,ch.blinkenlights.android.vanilla,Z3A6QU9xcFRPSFdzbmhDT0hDUXl4bEZtcmljLVFDNXVWcF85SjdUQmJJTnVBalA0SzJMcTVNYmVka2tYazFhQi1LSWVKeUF3T3hzbzQ0OHdTdEJMOTl3OFE,Russian,,5,2017-03-30,Сергеи. Завадовский.,"",Спасибо разработчики за хороший плеер музыкальный Так держать Ребята только неэ спать и ничего больше,,
Vanilla Music,Google Play,ch.blinkenlights.android.vanilla,Z3A6QU9xcFRPSGNZRTZINGRjeDI3NDUwNTFfV1MzNVpGa2RsM3RRVngtTy1OX0w1eWVfOFZSY21ubGk0Z3pfc1RLZjZlSkZyWXpNLXl4cmQ0VTZJSDR0SFE,Russian,,5,2017-03-19,Феликс Фрай,"","Прекрасный звук. Что редкость. А плееры для звука и существуют. Изначально)) P.S. не смог понять как из сети обложки качать,но это совсем не важно. Можно и самому ставить при необходимости. Резюме - как приятно когда плеер хорошо звучит!!!!",,
Vanilla Music,Google Play,ch.blinkenlights.android.vanilla,Z3A6QU9xcFRPRUdrY2t2QUpxM2o0aURLYWdoeDVXUENXdTh2YUFGeFlGNklWd29MYUhHM3BXSkdZMG00TjBJd3hVZFFXQXByd1dVYkU5R3Zfcm5Lem5vWWc,Russian,,2,2017-03-16,Абросимов Фёдор,"",Start to be very slowly after update :-(,,
Vanilla Music,Google Play,ch.blinkenlights.android.vanilla,Z3A6QU9xcFRPRVFVNm5PNFZ2bVV5bUkyZlJuZS1ZdjY2NTJ3bXdtZS1BaEg0cmxjdW9NQmdGekJoZkkzaldVMDMxUmtURDhPM1d5VmthWkVEZDVmYmhmQmc,Russian,,5,2017-03-12,Дмитрий Некрашевич,"","Не могу приложить скриншоты чтобы объяснить свой восторг от того, что этот плеер видит всевозможные теги (другие не видят и в библиотеке в итоге нет некоторых исполнителей) +проигрывает папки, +группирует альбомы по папкам. Правда управление не лучшее: например выбрал песню, она закончилась, а следующая не началась, оказалось в очереди воспроизведения одна песня. Думаю удобнее ткнуть в одну песню и пусть следующая за ней играет, закончился альбом/папка - автоматом переход к следующему. Ещё гляну не повторяются ли треки если включить все вразнобой. И в эквалайзер (у меня вайпер) проще с рабочего стола попасть чем из плеера.",,
Vanilla Music,Google Play,ch.blinkenlights.android.vanilla,Z3A6QU9xcFRPSDhrQllhdmpxSHRvODV1SDdRc0pMTUdoNWQxak0tbWVPZlZaZ0hETmhncXY0OHU3QnVHeUF1TEw3dU14VjZSLVFqdjFaakVyRjAyRGk5WHc,Russian,,5,2017-02-28,Влд Док,"",Add url stream !,,
Vanilla Music,Google Play,ch.blinkenlights.android.vanilla,Z3A6QU9xcFRPSEZuUHZsUWJ5ZkFoV1k1THViOWlEMVZpZ19LcGFzRnRibEpOdmNDVWdhcUUxUG81TmItbEVXOFJ2eERfbHRxY3cyRjlLNTZKUG9XM3V0bHc,Russian,,5,2017-02-28,Pavel Podkorytov,"","Самый подходящий мне плеер, всё хорошо. Автор, иногда сбрасывается прогресс прослушивания - для аудиокниг не удобно, это проблема смартфона или плеера? В стандартном плеере тоже иногда бывает.",,
Vanilla Music,Google Play,ch.blinkenlights.android.vanilla,Z3A6QU9xcFRPRXQ1X0J0V1RIXzhvZGItNjBQLURwRmowS2FmNkNiUUhTS01vZUZ6Ml9EQmo0SExfRUhzLVBYc2Q5WGFhX1FwM056dFYtZmFhWHZrRDBGcWc,Russian,,4,2017-01-25,Евгений Лукьянцев,"","Отличный апп. Не хватает возможности указать папку из которой считывать медиафайлы, а то добавляет всё что только есть.",,
Vanilla Music,Google Play,ch.blinkenlights.android.vanilla,Z3A6QU9xcFRPRk4wUEs2bFdkSGRrZ011QUJXRHU1V2Rmd0plMDhhdUh5MktVaTdEdUEzRVZjVlk0NjJxamJWVVVqR2tPUkJ2aFVoa3B5YmlmbVIxZGxpdnc,Russian,,3,2016-12-02,Вахобов Абдуазиз,Нехватка,Добавьте кнопку в экране воспроизведения рядом с кнопкой добавить в избранное кнопку эквалайзер,,
Vanilla Music,Google Play,ch.blinkenlights.android.vanilla,Z3A6QU9xcFRPRndNdUVlaXlEb0FyTTZTMDNmeVJkUmFjcE9PMTR0SFBGSlh1V296VzJyM3NhczdxaTZvdU1GRVdDdWh5SnltVTduRVUxYS1lcUhSa1BEVGc,Russian,,5,2016-11-20,Alexander Koshevoy,cool,"cool player and it's great that open. I'm even more grateful to developers, if you add the ability to display a scroll bar at the bottom of the playback screen",,
Vanilla Music,Google Play,ch.blinkenlights.android.vanilla,Z3A6QU9xcFRPRTY2eVRhNmR5RWZfU29BV1RhQ254UEpjc004TnEtd2NidVBXbm5UOHViRm9aRm1HUlJBbWFMblQ1NUtnYmJnelBvWFExemZpLUdOT1dDTlE,Russian,,1,2016-11-09,uri efimov,Не видит кириллицу,Не видит кириллицу,,
Vanilla Music,Google Play,ch.blinkenlights.android.vanilla,Z3A6QU9xcFRPSEwyVHV5QWRZWVc2Rk9mN3E1b1NqYzFnQmhtTDNLSUhvLWFibkVsTUs4WnZBYjBkZWQ4TWp1c1NERlFWYkNFckdTamxSR2s3NWphcVJQTXc,Russian,,5,2016-11-03,Ruslan Muzychenko,"Минималистичный, без лишних наворотов.","Самый лучший из всех, что перепробовал. Простой и понятный интерфейс. Порадовало управление встряхиванием. Бесплатный и без рекламы. Ничего лишнего. Разработчики молодцы, так держать!",,
Vanilla Music,Google Play,ch.blinkenlights.android.vanilla,Z3A6QU9xcFRPSGNHZnIwNXJFeGR5TWE0NzJwWG5ZT3JVS0RPSTdRc1kxR09lZVFxdTUzQXI2bGJyVl81ZXk2Ty1XZmpzcGJlTkF6SVhhNHp0QTN6SnVEc1E,Russian,,5,2016-10-29,"","",The best media player!!!,,
Vanilla Music,Google Play,ch.blinkenlights.android.vanilla,Z3A6QU9xcFRPSF92TUpDQ2NwOGlNUVZUYzdaa3Zfa2kzVzFGLUdfZGcwRVIza1dOZ3gzcmZqZkRoTjUxUlh3Y0xhUUE2MHI4RUJPTUY2WVR0VmczMi1IMHc,Russian,,5,2016-10-13,Евгений Скляр,"","Good, but no equaliser",,
Vanilla Music,Google Play,ch.blinkenlights.android.vanilla,Z3A6QU9xcFRPR1pHdVRCb3k4NEVpY0NZVzhoRWpFV05Rejlzc3NDX1lCN21udXVRdlhXTmZ3MHpLc09vZXFQN0ZZYXdWYkVzSlBKcmNudVpNT2E4V0ZsSXc,Russian,,5,2016-08-27,Александр Суворов,Лучший плеер,Огромное спасибо за такой прекрасный плеер. Давно пользуюсь. Ничего другого не нужно. Просто фантастика! Молодцы!,,
Vanilla Music,Google Play,ch.blinkenlights.android.vanilla,Z3A6QU9xcFRPR0stREJYRjdaVUtMZDVkZmRvWXB0TmRnSExsVHlaMzN6cDBOOHZGdjVlVTNPaTZEbk9tWHloTF91d2xJNkNCMWtqUGxMYk5GbWhXLTFNSUE,Russian,,5,2016-08-22,Банщиков Денис,Огромное спасибо за разработку!,Всегда знал что самый лучший софт пишиться под лицензией GPLv3.Лучший продукт,,
Vanilla Music,Google Play,ch.blinkenlights.android.vanilla,Z3A6QU9xcFRPSDhSWC1pcWVqTHM2TWpWUGRiRy15Vnc1WV9NS2RyeFBVUXBEV3B2T240LUJBTlNsQWJWYVhZMnNLekhGSXRqNkh1a1RtTWE5Y01lTXRwakE,Russian,,5,2016-07-16,Irakly Gagua,"",Можно проигрывать папку целиком. Это хорошо.,,
Vanilla Music,Google Play,ch.blinkenlights.android.vanilla,Z3A6QU9xcFRPRXlVeEZuVEdQdGhWNllDRHE2QkJRbzBxdGkxck9iczlsUTFfWUh3cGZRcEUycWRfSnRsUm5CUHNGTnBmcTA5blM5YnAwMkI2NzJnczlUQnc,Russian,,5,2016-06-29,Gari Baron,Хорошо,Очень,,
Vanilla Music,Google Play,ch.blinkenlights.android.vanilla,Z3A6QU9xcFRPR2dEb0F1WUVFM1R1TjRPbE9zRFpmYXBZNmZwS2FxUGVmZmUxSnBFWW9OVmlCcEFYXzJFc2hWTU5hUlI3R1otRV84UEZGcFFmcVhXZXQ1V0E,Russian,,5,2016-06-15,Денис Владимирович,"",Отличный плеер без ненужных наворотов,,
Vanilla Music,Google Play,ch.blinkenlights.android.vanilla,Z3A6QU9xcFRPRS0ta0pVazQ5azd2WFNEdGJUNGFPRWh2NEh1cFMwbW5UTmpfeFdIa1Q1TmNoSEtOOVZaZHdCMEN6cTBuZGthdmx1MmhUdVpmZWhtdjNkSFE,Russian,,5,2016-05-07,Безматерных Максим,"",Не работает,,
Vanilla Music,Google Play,ch.blinkenlights.android.vanilla,Z3A6QU9xcFRPRnJ4OVVLZzdZSURpVmdadjNRb3BmOFZYQlZoa3lzRVRXZEVOM2tuSDRSWlN2V1VnbTE3a29ZWXpyREt1MUx1MEdGNXQ3YjBYcjJHdGZ0dEE,Russian,,5,2015-12-02,Seyran Suleymanov,"",Удобный простой плеер с чистым звучанием.,,
Vanilla Music,Google Play,ch.blinkenlights.android.vanilla,Z3A6QU9xcFRPR3hScTNKWU9fVFU5X3FsSzdpOHRlRVFuemRMYy0zbUJDRFRDemZrZXJlWEw4LTRxWnVycnZ6dEtvakZDcUU4UmdpbTJYSFlsSkI5bVNfVlE,Russian,,5,2015-06-12,Anny More,Мой самый любимый плеер,This pleer is great! Love it,,
Vanilla Music,Google Play,ch.blinkenlights.android.vanilla,Z3A6QU9xcFRPSFIxcW5lZVVmOTRNaFVETWoxbUNwX19uVW9YMUh1RnBiRjltVmNhUEVoaUQyMmkyUklPajNxYkduM1AyYUYxVi1XczViM1EyUGhFcWttZ3c,Russian,,5,2014-12-18,Sergey Seredin,Fastest.,"",,
Vanilla Music,Google Play,ch.blinkenlights.android.vanilla,Z3A6QU9xcFRPRzJmSVd4UUJfYk9zU2RCUXBZa2d5THJyejF4d3JOZEJvQlQ2MXVYTVItaEdfc0lrZnR4VFV6cThVeHNLM2xIWWlhQXdoZVFjQzNyTGFLd2c,Russian,,5,2014-11-04,Серега Косьянюк,Отлично,Спасибо за исходники (^_^) очень помогли,,
Vanilla Music,Google Play,ch.blinkenlights.android.vanilla,Z3A6QU9xcFRPR2JNWFl6S1M0YktTM3BLRnJzb0h4YVpDenBTVzBNczR6Unc5YmlQYXpvQjVVTG9NTEpyOTNGNU9fak9YYzMyRFpVRGN1bTRBdjVIWUN5WGc,Russian,,4,2014-10-29,Aleksandr Rabshtyna,"","Впрочем неплохой, только подскажите а как передавать песни?",,
